,AllAuthors,FirstName1stAuthor,Gender,Place,Year,NumberOfAuthors,Title,Conference,FirstName2ndAuthor,Gender2,FirstName3rdAuthor,Gender3,FirstName4thAuthor,Gender4,FirstName5thAuthor,Gender5,FirstName6thAuthor,Gender6,FirstName7thAuthor,Gender7,FirstName8thAuthor,Gender8,FirstName9thAuthor,Gender9,FirstName10thAuthor,Gender10,FirstName11thAuthor,Gender11,FirstName12thAuthor,Gender12,FirstName13thAuthor,Gender13,FirstName14thAuthor,Gender14,FirstName15thAuthor,Gender15,FirstName16thAuthor,Gender16,FirstName17thAuthor,Gender17,Probability1,Probability2,Probability3,Probability4,Probability5,Probability6,Probability7,Probability8,Probability9,Probability10,Probability11,Probability12,Probability13,Probability14,Probability15,Probability16,Probability17
,"Camurri, Antonio; Trocca, Riccardo; Volpe, Gualtiero",Antonio,male,Sweden,2002,3,Real-time analysis of expressive cues in human movement,ICMC,Riccardo,male,Gualtiero,male,,,,,,,,,,,,,,,,,,,,,,,,,,,,,1,1,1,,,,,,,,,,,,,,
,"Trautmann, Steven",Steven,male,Sweden,2002,1,Differential PCM Representation of Acoustic Instruments and Wavetable Synthesis,ICMC,,,,,,,,,,,,,,,,,,,,,,,,,,,,,,,,,1,,,,,,,,,,,,,,,,
,"ffitch, John; Padget, Julian",John,male,Sweden,2002,2,Learning to Play and Perform on Synthetic Instruments,ICMC,Julian,male,,,,,,,,,,,,,,,,,,,,,,,,,,,,,,,0.99,1,,,,,,,,,,,,,,,
,"Polfreman, Richard",Richard,male,Sweden,2002,1,MfOM: a Library for Building and Controlling Physical Model Instruments in Open Music,ICMC,,,,,,,,,,,,,,,,,,,,,,,,,,,,,,,,,1,,,,,,,,,,,,,,,,
,"Andrews, Richard",Richard,male,Sweden,2002,1,Center for New Music and Audio Technologies (CNMAT): Studio Report,ICMC,,,,,,,,,,,,,,,,,,,,,,,,,,,,,,,,,1,,,,,,,,,,,,,,,,
,"Lassfolk, Kai",Kai,male,Sweden,2002,1,University of Helsinki Music Research Laboratory and Electronic Music Studio - A Studio Report,ICMC,,,,,,,,,,,,,,,,,,,,,,,,,,,,,,,,,0.87,,,,,,,,,,,,,,,,
,"Hartono, Pitoyo; Suzuki, Kenji; Qi, Hai; Hashimoto, Shuji",Pitoyo,male,Sweden,2002,4,Subjective Preference Oriented Global Sound Database,ICMC,Kenji,male,Hai,male,Shuji,male,,,,,,,,,,,,,,,,,,,,,,,,,,,1,0.96,0.84,1,,,,,,,,,,,,,
,"Vinet, Hugues; Herrera, Perfecto; Pachet, FranМ¤ois",Hugues,male,Sweden,2002,3,The CUIDADO Project: New Applications based on Audio and Music Content Description,ICMC,Perfecto,male,FranМ¤ois,male,,,,,,,,,,,,,,,,,,,,,,,,,,,,,1,1,0.99,,,,,,,,,,,,,,
,"Peeters, Geoffroy; Rodet, Xavier",Geoffroy,male,Sweden,2002,2,Automatically selecting signal descriptors for SoundClassification,ICMC,Xavier,male,,,,,,,,,,,,,,,,,,,,,,,,,,,,,,,1,0.99,,,,,,,,,,,,,,,
,"Neagle, Royce; Ng, Kia; Ruddle, Roy A.",Royce,male,Sweden,2002,3,Notation and 3D Animation of Dance Movement,ICMC,Kia,female,Roy,male,,,,,,,,,,,,,,,,,,,,,,,,,,,,,0.91,0.95,0.99,,,,,,,,,,,,,,
,"Hu, Ning; Dannenberg, Roger B.; Lewis, Ann L.",Ning,female,Sweden,2002,3,A Probabilistic Model of Melodic Similarity,ICMC,Roger,male,Ann,female,,,,,,,,,,,,,,,,,,,,,,,,,,,,,0.8,1,0.99,,,,,,,,,,,,,,
,"Renz, Kai",Kai,male,Sweden,2002,1,An Improved Algorithm for Spacing a Line of Music,ICMC,,,,,,,,,,,,,,,,,,,,,,,,,,,,,,,,,0.87,,,,,,,,,,,,,,,,
,"MacMillan, Karl; Droettboom, Michael; Fujinaga, Ichiro",Karl,male,Sweden,2002,3,Gamera: Optical music recognition in a new shell,ICMC,Michael,male,Ichiro,male,,,,,,,,,,,,,,,,,,,,,,,,,,,,,1,1,1,,,,,,,,,,,,,,
,"Overholt, Dan",Dan,male,Sweden,2002,1,New Mappings for the MATRIX Interface,ICMC,,,,,,,,,,,,,,,,,,,,,,,,,,,,,,,,,0.98,,,,,,,,,,,,,,,,
,"Young, Diana",Diana,female,Sweden,2002,1,The Hyperbow: A Precision Violin Interface,ICMC,,,,,,,,,,,,,,,,,,,,,,,,,,,,,,,,,0.99,,,,,,,,,,,,,,,,
,"Marshall, Mark; Moynihan, Breege; Rath, Matthias",Mark,male,Sweden,2002,3,The Vodhran - Design and Development of a Virtual Instrument,ICMC,Breege,female,Matthias,male,,,,,,,,,,,,,,,,,,,,,,,,,,,,,1,None,1,,,,,,,,,,,,,,
,"Geiger, Guenter",Guenter,male,Sweden,2002,1,An Interpreted Language for Real Time Signal Processing,ICMC,,,,,,,,,,,,,,,,,,,,,,,,,,,,,,,,,1,,,,,,,,,,,,,,,,
,"Rioux, Vincent; Poletti, Manuel",Vincent,male,Sweden,2002,2,An experimental SDIF-sampler in Max/MSP,ICMC,Manuel,male,,,,,,,,,,,,,,,,,,,,,,,,,,,,,,,1,1,,,,,,,,,,,,,,,
,"Dannenberg, Roger B.",Roger,male,Sweden,2002,1,A Language for Interactive Audio Applications,ICMC,,,,,,,,,,,,,,,,,,,,,,,,,,,,,,,,,1,,,,,,,,,,,,,,,,
,"Fischman, Rajmil",Rajmil,male,Sweden,2002,1,Application of Mathematical Models to the Generation of Organic Musical Structure and Discourse in Composition: Research Summary,ICMC,,,,,,,,,,,,,,,,,,,,,,,,,,,,,,,,,None,,,,,,,,,,,,,,,,
,"Nichols, Charles",Charles,male,Sweden,2002,1,The vBow: A Four Degrees of Freedom Haptic Musical Controller Human-Computer Interface,ICMC,,,,,,,,,,,,,,,,,,,,,,,,,,,,,,,,,1,,,,,,,,,,,,,,,,
,"FernstrМ¦m, Mikael; McElligott, Lisa; Dillon, Michelle; McGettrick, Colm",Mikael,male,Sweden,2002,4,"""PuSH-Overture"" - Extending the Playability of the Traditional Musical Instrument",ICMC,Lisa,female,Michelle,female,Colm,male,,,,,,,,,,,,,,,,,,,,,,,,,,,1,1,1,1,,,,,,,,,,,,,
,"Burtner, Matthew",Matthew,male,Sweden,2002,1,The Metasaxophone: Design of a New Computer Music Controller,ICMC,,,,,,,,,,,,,,,,,,,,,,,,,,,,,,,,,1,,,,,,,,,,,,,,,,
,"Ng, Kia; Scott, Jon",Kia,female,Sweden,2002,2,A Distributed Real-time System for Interactive Music Mapping with Multiple Inputs,ICMC,Jon,male,,,,,,,,,,,,,,,,,,,,,,,,,,,,,,,0.95,1,,,,,,,,,,,,,,,
,"Thibault, Francois; Depalle, Philippe",Francois,male,Sweden,2002,2,OLW: An Extension to MSP for the Implementation of Overlap-Windowing Techniques,ICMC,Philippe,male,,,,,,,,,,,,,,,,,,,,,,,,,,,,,,,1,0.99,,,,,,,,,,,,,,,
,"Miranda, Eduardo Reck",Eduardo,male,Sweden,2002,1,Voices of Artificial Life: On Making Music with Computer Models of Nature,ICMC,,,,,,,,,,,,,,,,,,,,,,,,,,,,,,,,,1,,,,,,,,,,,,,,,,
,"Ariza, Christopher",Christopher,male,Sweden,2002,1,Prokaryotic Groove: Rhythmic Cycles as Real-Value Encoded Genetic Algorithms,ICMC,,,,,,,,,,,,,,,,,,,,,,,,,,,,,,,,,1,,,,,,,,,,,,,,,,
,"Burns, Christopher",Christopher,male,Sweden,2002,1,Tracing Compositional Process: Software synthesis code as documentary evidence,ICMC,,,,,,,,,,,,,,,,,,,,,,,,,,,,,,,,,1,,,,,,,,,,,,,,,,
,"Nuhn, Ralf; Eaglestone, Barry; Ford, Nigel; Moore, Adrian; Brown, Guy",Ralf,male,Sweden,2002,5,A Qualitative Analysis of Composers at Work,ICMC,Barry,male,Nigel,male,Adrian,male,Guy,male,,,,,,,,,,,,,,,,,,,,,,,,,1,0.98,1,0.97,1,,,,,,,,,,,,
,"Geslin, Yann; Mullon, Pascal; Jacob, Max",Yann,male,Sweden,2002,3,Ecrins: an audio-content description environment for sound samples,ICMC,Pascal,male,Max,male,,,,,,,,,,,,,,,,,,,,,,,,,,,,,0.98,0.99,0.98,,,,,,,,,,,,,,
,"Whitman, Brian; Lawrence, Steve",Brian,male,Sweden,2002,2,Inferring Descriptions and Similarity for Music from Community Metadata,ICMC,Steve,male,,,,,,,,,,,,,,,,,,,,,,,,,,,,,,,1,1,,,,,,,,,,,,,,,
,"Ramstrum, Momilani",Momilani,female,Sweden,2002,1,"Hegel, Heidegger and Borgmann's Substantive Implications for Music and Technology",ICMC,,,,,,,,,,,,,,,,,,,,,,,,,,,,,,,,,None,,,,,,,,,,,,,,,,
,"Bresin, Roberto",Roberto,male,Cuba,2001,1,Articulation Rules For Automatic Music Performance,ICMC,,,,,,,,,,,,,,,,,,,,,,,,,,,,,,,,,1,,,,,,,,,,,,,,,,
,"Jehan, Tristan; Schoner, Bernd",Tristan,male,Cuba,2001,2,An Audio-Driven Perceptually Meaningful Timbre Synthesizer,ICMC,Bernd,male,,,,,,,,,,,,,,,,,,,,,,,,,,,,,,,0.95,1,,,,,,,,,,,,,,,
,"Farbood, Mary; Schoner, Bernd",Mary,female,Cuba,2001,2,Analysis and Synthesis of Palestrina-Style Counterpoint Using Markov Chains,ICMC,Bernd,male,,,,,,,,,,,,,,,,,,,,,,,,,,,,,,,1,1,,,,,,,,,,,,,,,
,"Sarti, Augusto; Tubaro, Stefano",Augusto,male,Cuba,2001,2,Object-Based Sound Synthesis,ICMC,Stefano,male,,,,,,,,,,,,,,,,,,,,,,,,,,,,,,,1,1,,,,,,,,,,,,,,,
,"Fourcade, Patrick; Cadoz, Claude",Patrick,male,Cuba,2001,2,Physical modeling for sound synthesis with particle-interaction Networks: Study of the percussion phenomena and conception of a generic module for percussion,ICMC,Claude,male,,,,,,,,,,,,,,,,,,,,,,,,,,,,,,,1,0.81,,,,,,,,,,,,,,,
,"Dahlstedt, Palle",Palle,male,Cuba,2001,1,Creating and Exploring Huge Parameter Spaces: Interactive Evolution as a Tool for Sound Generation,ICMC,,,,,,,,,,,,,,,,,,,,,,,,,,,,,,,,,1,,,,,,,,,,,,,,,,
,"Didkovsky, Nick; Burk, Philip L.",Nick,male,Cuba,2001,2,"Java Music Specification Language, an introduction and overview",ICMC,Philip,male,,,,,,,,,,,,,,,,,,,,,,,,,,,,,,,0.99,1,,,,,,,,,,,,,,,
,"Burtner, Matthew; Serafin, Stefania",Matthew,male,Cuba,2001,2,Real Time Extended Physical Models for the Composer and Performer,ICMC,Stefania,female,,,,,,,,,,,,,,,,,,,,,,,,,,,,,,,1,0.99,,,,,,,,,,,,,,,
,"Nackaerts, Axel; De Moor, Bart; Lauwereins, Rudy",Axel,male,Cuba,2001,3,Parameter estimation for dual-polarization plucked string models,ICMC,Bart,male,Rudy,male,,,,,,,,,,,,,,,,,,,,,,,,,,,,,0.98,0.99,0.95,,,,,,,,,,,,,,
,"Thordarson, Hilmar; Fridriksson, Rikhardur H.",Hilmar,male,Cuba,2001,2,Kopavogur Computer Music Center (KCMC),ICMC,Rikhardur,male,,,,,,,,,,,,,,,,,,,,,,,,,,,,,,,1,None,,,,,,,,,,,,,,,
,"Rocchesso, Davide",Davide,male,Cuba,2001,1,Simple resonators with shape control,ICMC,,,,,,,,,,,,,,,,,,,,,,,,,,,,,,,,,1,,,,,,,,,,,,,,,,
,"Moon, Barry",Barry,male,Cuba,2001,1,Temporal Filtering: Framing Sonic Objects,ICMC,,,,,,,,,,,,,,,,,,,,,,,,,,,,,,,,,0.98,,,,,,,,,,,,,,,,
,"Fells, Nick; BМ¦hm, Carola",Nick,male,Cuba,2001,2,"Studio Report of The Centre for Music Technology, University of Glasgow",ICMC,Carola,female,,,,,,,,,,,,,,,,,,,,,,,,,,,,,,,0.99,1,,,,,,,,,,,,,,,
,"Foote, Jonathan; Cooper, Matthew",Jonathan,male,Cuba,2001,2,Visualizing Musical Structure and Rhythm via Self-Similarity,ICMC,Matthew,male,,,,,,,,,,,,,,,,,,,,,,,,,,,,,,,1,1,,,,,,,,,,,,,,,
,"Kuuskankare, Mika; Laurson, Mikael",Mika,male,Cuba,2001,2,ENP: Musical Notation Library based on Common Lisp and CLOS,ICMC,Mikael,male,,,,,,,,,,,,,,,,,,,,,,,,,,,,,,,0.51,1,,,,,,,,,,,,,,,
,"Schouten, Tom; de Moor, Bart",Tom,male,Cuba,2001,2,Subband HTLS,ICMC,Bart,male,,,,,,,,,,,,,,,,,,,,,,,,,,,,,,,1,0.99,,,,,,,,,,,,,,,
,"RМ¦bel, Axel",Axel,male,Cuba,2001,1,Adaptive additive synthesis using spline based parameter trajectory models,ICMC,,,,,,,,,,,,,,,,,,,,,,,,,,,,,,,,,0.98,,,,,,,,,,,,,,,,
,"D'haes, Wim; Rodet, Xavier",Wim,male,Cuba,2001,2,Automatic Estimation of Control Parameters: An Instance-Based Learning Approach,ICMC,Xavier,male,,,,,,,,,,,,,,,,,,,,,,,,,,,,,,,0.99,0.99,,,,,,,,,,,,,,,
,"Wun, Cheuk-Wai; Horner, Andrew; Ayers, Lydia",Cheuk-Wai,None,Cuba,2001,3,Perceptual Wavetable Matching for Synthesis of Musical Instrument Tones,ICMC,Andrew,male,Lydia,female,,,,,,,,,,,,,,,,,,,,,,,,,,,,,None,1,1,,,,,,,,,,,,,,
,"Austin, Larry; Thompson, Michael",Larry,male,Cuba,2001,2,Williams [re]Mix[er]: An Interactive I Ching Composing Program,ICMC,Michael,male,,,,,,,,,,,,,,,,,,,,,,,,,,,,,,,1,1,,,,,,,,,,,,,,,
,"Cambouropoulos, Emilios",Emilios,male,Cuba,2001,1,The Local Boundary Detection Model (LBDM) and its Application in the Study of Expressive Timing,ICMC,,,,,,,,,,,,,,,,,,,,,,,,,,,,,,,,,0.67,,,,,,,,,,,,,,,,
,"Rossignol, StМ©phane; Desain, Peter; Honing, Henkjan",StМ©phane,male,Cuba,2001,3,Refined Knowledge-Based ®Х0 Tracking: Comparing Three Frequency Extraction Methods,ICMC,Peter,male,Henkjan,male,,,,,,,,,,,,,,,,,,,,,,,,,,,,,0.99,1,None,,,,,,,,,,,,,,
,"Iturbide, Manuel Rocha",Manuel,male,Cuba,2001,1,"The international sound art festival in Mexico City: Sound, its relationship to the art disciplines and to the new technologies",ICMC,,,,,,,,,,,,,,,,,,,,,,,,,,,,,,,,,1,,,,,,,,,,,,,,,,
,"DМ©chelle, FranМ¤ois; Geiger, GМ_nter; Phillips, Dave",FranМ¤ois,male,Cuba,2001,3,Demudi: The Debian Multimedia Distribution,ICMC,GМ_nter,male,Dave,male,,,,,,,,,,,,,,,,,,,,,,,,,,,,,0.99,1,1,,,,,,,,,,,,,,
,"Cemgil, Ali Taylan; Kappen, Bert",Ali,male,Cuba,2001,2,Bayesian Real-time Adaptation for Interactive Performance Systems,ICMC,Bert,male,,,,,,,,,,,,,,,,,,,,,,,,,,,,,,,0.85,0.96,,,,,,,,,,,,,,,
,"Laurson, Mikael; Kuuskankare, Mika",Mikael,male,Cuba,2001,2,PWSynth: A Lisp-based Bridge between Computer Assisted Composition and Model Based Synthesis,ICMC,Mika,male,,,,,,,,,,,,,,,,,,,,,,,,,,,,,,,1,0.51,,,,,,,,,,,,,,,
,"Hainsworth, Stephen W.; Macleod, Malcolm D.",Stephen,male,Cuba,2001,2,Automatic Bass Line Transcription from Polyphonic Music,ICMC,Malcolm,male,,,,,,,,,,,,,,,,,,,,,,,,,,,,,,,1,1,,,,,,,,,,,,,,,
,"Erkut, Cumhur; Laurson, Mikael; Kuuskankare, Mika; VМ«limМ«ki, Vesa",Cumhur,male,Cuba,2001,4,Model-based Synthesis of the Ud and the Renaissance Lute,ICMC,Mikael,male,Mika,male,Vesa,male,,,,,,,,,,,,,,,,,,,,,,,,,,,1,1,0.51,0.93,,,,,,,,,,,,,
,"Sapp, Craig Stuart",Craig,male,Cuba,2001,1,Harmonic Visualizations of Tonal Music,ICMC,,,,,,,,,,,,,,,,,,,,,,,,,,,,,,,,,1,,,,,,,,,,,,,,,,
,"Sakakibara, Ken-Ichi; Imagawa, Hiroshi; Kouishi, Tomoko; Kondo, Kazumasa; Murano, Emi Zuiki; Kumada, Masanobu; Niimi, Seiji",Ken-Ichi,male,Cuba,2001,7,Vocal Fold and False Vocal Fold Vibrations in Throat Singing and Synthesis of KhМ¦М¦mei,ICMC,Hiroshi,male,Tomoko,female,Kazumasa,male,Emi,female,Masanobu,male,Seiji,None,,,,,,,,,,,,,,,,,,,,,1,1,0.96,1,0.85,1,0.55,,,,,,,,,,
,"JМ«rvelМ«inen, Hanna; VМ«limМ«ki, Vesa",Hanna,female,Cuba,2001,2,Audibility of Initial Pitch Glides in String Instrument Sounds,ICMC,Vesa,male,,,,,,,,,,,,,,,,,,,,,,,,,,,,,,,0.97,0.93,,,,,,,,,,,,,,,
,"Truchet, Charlotte; Assayag, GМ©rard; Codognet, Philippe",Charlotte,female,Cuba,2001,3,Visual and Adaptive Constraint Programming in Music,ICMC,GМ©rard,male,Philippe,male,,,,,,,,,,,,,,,,,,,,,,,,,,,,,1,1,0.99,,,,,,,,,,,,,,
,"Dixon, Simon",Simon,male,Cuba,2001,1,An Interactive Beat Tracking and Visualisation System,ICMC,,,,,,,,,,,,,,,,,,,,,,,,,,,,,,,,,0.99,,,,,,,,,,,,,,,,
,"Goudeseune, Camille; Kaczmarski, Hank",Camille,female,Cuba,2001,2,Composing Outdoor Augmented-Reality Sound Environments,ICMC,Hank,male,,,,,,,,,,,,,,,,,,,,,,,,,,,,,,,0.94,1,,,,,,,,,,,,,,,
,"Bencina, Ross; Burk, Phil",Ross,male,Cuba,2001,2,PortAudio - an Open Source Cross Platform Audio API,ICMC,Phil,male,,,,,,,,,,,,,,,,,,,,,,,,,,,,,,,0.95,0.99,,,,,,,,,,,,,,,
,"Dannenberg, Roger; Foote, Jonathan; Tzanetakis, George; Weare, Christopher",Roger,male,Cuba,2001,4,Panel: New directions in Music Information Retrieval,ICMC,Jonathan,male,George,male,Christopher,male,,,,,,,,,,,,,,,,,,,,,,,,,,,1,1,0.99,1,,,,,,,,,,,,,
,"Orio, Nicola; DМ©chelle, FranМ¤ois",Nicola,male,Cuba,2001,2,Score Following Using Spectral Analysis and Hidden Markov Models,ICMC,FranМ¤ois,male,,,,,,,,,,,,,,,,,,,,,,,,,,,,,,,0.71,0.99,,,,,,,,,,,,,,,
,"MacMillan, Karl; Droettboom, Michael; Fujinaga, Ichiro",Karl,male,Cuba,2001,3,A System to Port Unit Generators Between Audio DSP Systems,ICMC,Michael,male,Ichiro,male,,,,,,,,,,,,,,,,,,,,,,,,,,,,,1,1,1,,,,,,,,,,,,,,
,"Wanderley, Marcelo M.; Serra, Marie-HМ©lМ¬ne; Battier, Marc; Rodet, Xavier",Marcelo,male,Cuba,2001,4,Gestural Control at IRCAM,ICMC,Marie-HМ©lМ¬ne,female,Marc,male,Xavier,male,,,,,,,,,,,,,,,,,,,,,,,,,,,1,1,1,0.99,,,,,,,,,,,,,
,"Hainsworth, Stephen W.; Wolfe, Patrick J.",Stephen,male,Cuba,2001,2,Time-Frequency Reassignment for Music Analysis,ICMC,Patrick,male,,,,,,,,,,,,,,,,,,,,,,,,,,,,,,,1,1,,,,,,,,,,,,,,,
,"Gurevich, Michael; von Muehlen, Stephan",Michael,male,Cuba,2001,2,The Accordiatron: A Gestural Interface for Interactive Music,ICMC,Stephan,male,,,,,,,,,,,,,,,,,,,,,,,,,,,,,,,1,1,,,,,,,,,,,,,,,
,"Avanzini, Federico; Rocchesso, Davide",Federico,male,Cuba,2001,2,Controlling Material Properties in Physical Models of Sounding Objects,ICMC,Davide,male,,,,,,,,,,,,,,,,,,,,,,,,,,,,,,,1,1,,,,,,,,,,,,,,,
,"Hamanaka, Masatoshi; Goto, Masataka; Otsu, Nobuyuki",Masatoshi,male,Cuba,2001,3,Learning-Based Jam Session System for A Guitar Trio,ICMC,Masataka,male,Nobuyuki,male,,,,,,,,,,,,,,,,,,,,,,,,,,,,,1,1,1,,,,,,,,,,,,,,
,"Fontana, Federico; Rocchesso, Davide; Apollonio, Enzo",Federico,male,Cuba,2001,3,Acoustic Cues from Shapes between Spheres and Cubes,ICMC,Davide,male,Enzo,male,,,,,,,,,,,,,,,,,,,,,,,,,,,,,1,1,1,,,,,,,,,,,,,,
,"Cook, Perry; Leider, Colby; Park, Tae Hong; Tzaneatakis, George",Perry,male,Cuba,2001,4,Princeton Sound Kitchen Open Source Software Report,ICMC,Colby,male,Tae,male,George,male,,,,,,,,,,,,,,,,,,,,,,,,,,,0.94,0.8,0.57,0.99,,,,,,,,,,,,,
,"Penttinen, Henri; Karjalainen, Matti; Paatero, Tuomas; JМ«rvelМ«inen, Hanna",Henri,male,Cuba,2001,4,New techniques to model reverberant instrument body responses,ICMC,Matti,male,Tuomas,male,Hanna,female,,,,,,,,,,,,,,,,,,,,,,,,,,,0.98,0.97,1,0.97,,,,,,,,,,,,,
,"Widmer, Gerhard",Gerhard,male,Cuba,2001,1,Inductive Learning of General and Robust Local Expression Principles,ICMC,,,,,,,,,,,,,,,,,,,,,,,,,,,,,,,,,1,,,,,,,,,,,,,,,,
,"Fontana, Federico; Savioja, Lauri; VМ«limМ«ki, Vesa",Federico,male,Cuba,2001,3,A Modified Rectangular Waveguide Mesh Structure with Interpolated Input and Output Points,ICMC,Lauri,male,Vesa,male,,,,,,,,,,,,,,,,,,,,,,,,,,,,,1,0.69,0.93,,,,,,,,,,,,,,
,"Puckette, Miller",Miller,male,Cuba,2001,1,"Synthesizing Sounds with Specified, Time-Varying Spectra",ICMC,,,,,,,,,,,,,,,,,,,,,,,,,,,,,,,,,0.84,,,,,,,,,,,,,,,,
,"Mazzoni, Dominic; Dannenberg, Roger B.",Dominic,male,Cuba,2001,2,A Fast Data Structure for Disk-Based Audio Editing,ICMC,Roger,male,,,,,,,,,,,,,,,,,,,,,,,,,,,,,,,0.97,1,,,,,,,,,,,,,,,
,"Anderson, Tue Haste; Jensen, Kristoffer",Tue,male,Cuba,2001,2,On the importance of phase information in additive analysis/synthesis of binaural sounds,ICMC,Kristoffer,male,,,,,,,,,,,,,,,,,,,,,,,,,,,,,,,1,1,,,,,,,,,,,,,,,
,"Chaudhary, Amar; Wessel, David; Rowe, Lawrence A.",Amar,male,Cuba,2001,3,Listener Evaluation of Reduction Strategies for Sinusoidal and Resonance Models,ICMC,David,male,Lawrence,male,,,,,,,,,,,,,,,,,,,,,,,,,,,,,0.88,1,1,,,,,,,,,,,,,,
,"Dannenberg, Roger B.; van de Lageweg, Patrick",Roger,male,Cuba,2001,2,A System Supporting Flexible Distributed Real-Time Music Processing,ICMC,Patrick,male,,,,,,,,,,,,,,,,,,,,,,,,,,,,,,,1,1,,,,,,,,,,,,,,,
,"MacMillan, Karl; Droettboom, Michael; Fujinaga, Ichiro",Karl,male,Cuba,2001,3,Audio Latency Measurements of Desktop Operating Systems,ICMC,Michael,male,Ichiro,male,,,,,,,,,,,,,,,,,,,,,,,,,,,,,1,1,1,,,,,,,,,,,,,,
,"Vergez, Christopher; Rodet, Xavier",Christopher,male,Cuba,2001,2,Trumpet and Trumpet Player: Model and Simulation in a Musical Context,ICMC,Xavier,male,,,,,,,,,,,,,,,,,,,,,,,,,,,,,,,1,0.99,,,,,,,,,,,,,,,
,"Hoskinson, Reynald; Pai, Dinesh",Reynald,male,Cuba,2001,2,Manipulation and Resynthesis with Natural Grains,ICMC,Dinesh,male,,,,,,,,,,,,,,,,,,,,,,,,,,,,,,,1,1,,,,,,,,,,,,,,,
,"Bahn, Curtis; Hahn, Tomie; Trueman, Dan",Curtis,male,Cuba,2001,3,Physicality and Feedback: A Focus on the Body in the Performance of Electronic Music,ICMC,Tomie,male,Dan,male,,,,,,,,,,,,,,,,,,,,,,,,,,,,,1,1,0.98,,,,,,,,,,,,,,
,"Puckette, Miller",Miller,male,Cuba,2001,1,New Public-Domain Realizations of Standard Pieces for Instruments and Live Electronics,ICMC,,,,,,,,,,,,,,,,,,,,,,,,,,,,,,,,,0.84,,,,,,,,,,,,,,,,
,"Helmuth, Mara; Watts, Chris; Bukvic, Ico",Mara,female,Cuba,2001,3,University of Cincinnati College Conservatory of Music Center for Computer Music,ICMC,Chris,male,Ico,male,,,,,,,,,,,,,,,,,,,,,,,,,,,,,0.96,0.93,1,,,,,,,,,,,,,,
,"de la Cuadra, Patricio; Master, Aaron; Sapp, Craig",Patricio,male,Cuba,2001,3,Efficient Pitch Detection Techniques for Interactive Music,ICMC,Aaron,male,Craig,male,,,,,,,,,,,,,,,,,,,,,,,,,,,,,0.99,1,1,,,,,,,,,,,,,,
,"Young, John P.",John,male,Cuba,2001,1,Using the Web for Live Interactive Music,ICMC,,,,,,,,,,,,,,,,,,,,,,,,,,,,,,,,,0.99,,,,,,,,,,,,,,,,
,"Smyth, Tamara; Smith, Julius O.",Tamara,female,Cuba,2001,2,A Musical Instrument Based on a Bioacoustic Model of a Cicada,ICMC,Julius,male,,,,,,,,,,,,,,,,,,,,,,,,,,,,,,,1,1,,,,,,,,,,,,,,,
,"Brandt, Eli",Eli,male,Cuba,2001,1,Hard Sync Without Aliasing,ICMC,,,,,,,,,,,,,,,,,,,,,,,,,,,,,,,,,0.52,,,,,,,,,,,,,,,,
,"Brandt, Eli",Eli,male,Cuba,2001,1,Implementing Temporal Type Constructors for Music Programming,ICMC,,,,,,,,,,,,,,,,,,,,,,,,,,,,,,,,,0.52,,,,,,,,,,,,,,,,
,"Lopez-Lezcano, Fernando",Fernando,male,Cuba,2001,1,CCRMA Studio Report,ICMC,,,,,,,,,,,,,,,,,,,,,,,,,,,,,,,,,1,,,,,,,,,,,,,,,,
,"Topol, Alexandre; Schaeffer, Florent",Alexandre,male,Cuba,2001,2,Enhancing sound description in VRML,ICMC,Florent,male,,,,,,,,,,,,,,,,,,,,,,,,,,,,,,,1,1,,,,,,,,,,,,,,,
,"Schaeffer, Florent; Natkin, StМ©phane; Topol, Alexandre",Florent,male,Cuba,2001,3,Functional Specification of a Distributed and Mobile Architecture for Virtual Sound Space Systems,ICMC,StМ©phane,male,Alexandre,male,,,,,,,,,,,,,,,,,,,,,,,,,,,,,1,0.99,1,,,,,,,,,,,,,,
,"Wright, James; Brandt, Eli",James,male,Cuba,2001,2,System-Level MIDI Performance Testing,ICMC,Eli,male,,,,,,,,,,,,,,,,,,,,,,,,,,,,,,,0.99,0.52,,,,,,,,,,,,,,,
,"Bensa, Julien; Gibaudan, Frederic; Jensen, Kristoffer; Kronland-Martinet, Richard",Julien,male,Cuba,2001,4,Note and Hammer Velocity Dependence of a Piano String Model Based on Coupled Digital Waveguides,ICMC,Frederic,male,Kristoffer,male,Richard,male,,,,,,,,,,,,,,,,,,,,,,,,,,,1,1,1,1,,,,,,,,,,,,,
,"Serafin, Stefania; Smith, Julius O.; Thornburg, Harvey; Mazzella, Frederic; Tellier, Arnaud; Thonier, Guillaume",Stefania,female,Cuba,2001,6,Data driven identification and computer animation of bowed string model,ICMC,Julius,male,Harvey,male,Frederic,male,Arnaud,male,Guillaume,male,,,,,,,,,,,,,,,,,,,,,,,0.99,1,0.98,1,0.99,1,,,,,,,,,,,
,"Garnett, Guy E.; Jonnalagadda, Mangesh; Elezovic, Ivan; Johnson, Timothy; Small, Kevin",Guy,male,Cuba,2001,5,Technological Advances for Conducting a Virtual Ensemble,ICMC,Mangesh,male,Ivan,male,Timothy,male,Kevin,male,,,,,,,,,,,,,,,,,,,,,,,,,1,1,1,1,1,,,,,,,,,,,,
,"JordМК, Sergi",Sergi,male,Cuba,2001,1,Improvising with Computers: A Personal Survey (1989-2001),ICMC,,,,,,,,,,,,,,,,,,,,,,,,,,,,,,,,,0.99,,,,,,,,,,,,,,,,
,"Bod, Rens",Rens,male,Cuba,2001,1,A Memory-Based Model for Music Analysis: Challenging the Gestalt Principles,ICMC,,,,,,,,,,,,,,,,,,,,,,,,,,,,,,,,,0.89,,,,,,,,,,,,,,,,
,"Fumarola, Martin",Martin,male,Cuba,2001,1,Delimitation of Compositive Constants in Electroacoustic Music from the Interior of Argentina,ICMC,,,,,,,,,,,,,,,,,,,,,,,,,,,,,,,,,1,,,,,,,,,,,,,,,,
,"Aramaki, Mitsuko; Guillemain, Philippe; Hoeb, Nathalie; Roure, Alain",Mitsuko,female,Cuba,2001,4,From Piano String Vibrations to the Acoustic Field Radiated by the Soundboard,ICMC,Philippe,male,Nathalie,female,Alain,male,,,,,,,,,,,,,,,,,,,,,,,,,,,1,0.99,1,1,,,,,,,,,,,,,
,"WМ_st, Otto; JordМК, Sergi",Otto,male,Cuba,2001,2,Architectural Overview of a System for Collaborative Music Composition Over the Web,ICMC,Sergi,male,,,,,,,,,,,,,,,,,,,,,,,,,,,,,,,1,0.99,,,,,,,,,,,,,,,
,"Normann, Immanuel; Purwins, Hendrik; Obermayer, Klaus",Immanuel,male,Cuba,2001,3,Spectrum of Pitch Differences Models the Perception of Octave Ambiguous Tones,ICMC,Hendrik,male,Klaus,male,,,,,,,,,,,,,,,,,,,,,,,,,,,,,1,1,0.98,,,,,,,,,,,,,,
,"Purwins, Hendrik; Blankertz, Benjamin; Obermayer, Klaus",Hendrik,male,Cuba,2001,3,Constant Q Profiles for Tracking Modulations in Audio Data Format,ICMC,Benjamin,male,Klaus,male,,,,,,,,,,,,,,,,,,,,,,,,,,,,,1,1,0.98,,,,,,,,,,,,,,
,"VМ«М«nМ«nen, Riitta",Riitta,female,Cuba,2001,1,Analysis and Synthesis of Room Acoustics Using the MPEG-4 Scene Description,ICMC,,,,,,,,,,,,,,,,,,,,,,,,,,,,,,,,,1,,,,,,,,,,,,,,,,
,"Overholt, Dan",Dan,male,Cuba,2001,1,The MATRIX: A New Musical Instrument for Interactive Performance,ICMC,,,,,,,,,,,,,,,,,,,,,,,,,,,,,,,,,0.98,,,,,,,,,,,,,,,,
,"Penrose, Christopher",Christopher,male,Cuba,2001,1,Frequency Shaping of Audio Signals,ICMC,,,,,,,,,,,,,,,,,,,,,,,,,,,,,,,,,1,,,,,,,,,,,,,,,,
,"Baird, Bridget; Izmirli, Ozgur",Bridget,female,Cuba,2001,2,Modeling the Tempo Coupling between an Ensemble and the Conductor,ICMC,Ozgur,male,,,,,,,,,,,,,,,,,,,,,,,,,,,,,,,1,1,,,,,,,,,,,,,,,
,"Misdariis, Nicolas; Nicolas, FranМ¤ois; Warusfel, Olivier; CaussМ©, RenМ©",Nicolas,male,Cuba,2001,4,Radiation Control on Multi-Loudspeaker Device : La TimМ©e,ICMC,FranМ¤ois,male,Olivier,male,RenМ©,male,,,,,,,,,,,,,,,,,,,,,,,,,,,1,0.99,0.99,0.99,,,,,,,,,,,,,
,"Arnspang, Jens; Jensen, Kristoffer; Murphy, Declan; Andersen, Tue Haste; Marentakis, Georgios",Jens,male,Cuba,2001,5,Music Informatics Laboratory,ICMC,Kristoffer,male,Declan,male,Tue,male,Georgios,male,,,,,,,,,,,,,,,,,,,,,,,,,1,1,1,1,1,,,,,,,,,,,,
,"de Paor, Paschall",Paschall,male,Cuba,2001,1,Music Technology: Pedagogy and Research @ the University of Limerick,ICMC,,,,,,,,,,,,,,,,,,,,,,,,,,,,,,,,,None,,,,,,,,,,,,,,,,
,"Wright, Matthew; Freed, Adrian; Lee, Ahm; Madden, Tim; Momeni, Ali",Matthew,male,Cuba,2001,5,Managing Complexity with Explicit Mapping of Gestures to Sound Control with OSC,ICMC,Adrian,male,Ahm,male,Tim,male,Ali,male,,,,,,,,,,,,,,,,,,,,,,,,,1,0.97,1,0.99,0.85,,,,,,,,,,,,
,"Madden, Timothy; Sith, Ronald Bruce; Wright, Matthew; Wessel, David",Timothy,male,Cuba,2001,4,Preparation for Interactive Live Computer Performance in Collaboration with a Symphony Orchestra,ICMC,Ronald,male,Matthew,male,David,male,,,,,,,,,,,,,,,,,,,,,,,,,,,1,1,1,1,,,,,,,,,,,,,
,"Andrews, Richard",Richard,male,Cuba,2001,1,Center for New Music and Audio Technologies (CNMAT): Studio Report,ICMC,,,,,,,,,,,,,,,,,,,,,,,,,,,,,,,,,1,,,,,,,,,,,,,,,,
,"Lartillot, Olivier; Dubnov, Shlomo; Assayag, GМ©rard; Bejerano, Gill",Olivier,male,Cuba,2001,4,Automatic Modeling of Musical Style,ICMC,Shlomo,male,GМ©rard,male,Gill,female,,,,,,,,,,,,,,,,,,,,,,,,,,,0.99,1,1,0.87,,,,,,,,,,,,,
,"Florens, Jean-Loup; Henry, Cyrille",Jean-Loup,male,Cuba,2001,2,Bowed string synthesis with force feedback gesture interaction,ICMC,Cyrille,male,,,,,,,,,,,,,,,,,,,,,,,,,,,,,,,1,0.96,,,,,,,,,,,,,,,
,"Conklin, Darrell; Anagnostopoulou, Christina",Darrell,male,Cuba,2001,2,Representation and Discovery of Multiple Viewpoint Patterns,ICMC,Christina,female,,,,,,,,,,,,,,,,,,,,,,,,,,,,,,,1,1,,,,,,,,,,,,,,,
