,AllAuthors,FirstName1stAuthor,Gender,Place,Year,NumberOfAuthors,Title,Conference,FirstName2ndAuthor,Gender2,FirstName3rdAuthor,Gender3,FirstName4thAuthor,Gender4,FirstName5thAuthor,Gender5,FirstName6thAuthor,Gender6,FirstName7thAuthor,Gender7,FirstName8thAuthor,Gender8,FirstName9thAuthor,Gender9,FirstName10thAuthor,Gender10,FirstName11thAuthor,Gender11,FirstName12thAuthor,Gender12,FirstName13thAuthor,Gender13,FirstName14thAuthor,Gender14,FirstName15thAuthor,Gender15,FirstName16thAuthor,Gender16,FirstName17thAuthor,Gender17,Probability1,Probability2,Probability3,Probability4,Probability5,Probability6,Probability7,Probability8,Probability9,Probability10,Probability11,Probability12,Probability13,Probability14,Probability15,Probability16,Probability17
,"d‰ЫЄAlessandro, Christophe; Noisternig, Markus; Le Beux, Sylvain; Picinali, Lorenzo; Katz, Brian FG; Jacquemin, Christian; Ajaj, Rami; Planes, Bertrand; Strurmel, Nicolas; Delprat, Nathalie",Christophe,male,Canada,2009,10,The ORA Project: Audio-Visual Live Electronics and the Pipe Organ,ICMC,Markus,male,Sylvain,male,Lorenzo,male,Brian,male,Christian,male,Rami,male,Bertrand,male,Nicolas,male,Nathalie,female,,,,,,,,,,,,,,,0.99,1,1,1,1,0.99,0.98,0.97,1,1,,,,,,,
,"Whittington, Stephen; Harrald, Luke",Stephen,male,Canada,2009,2,Hidden City: ‰ЫчBeing with‰ЫЄ in Improvised Performance,ICMC,Luke,male,,,,,,,,,,,,,,,,,,,,,,,,,,,,,,,1,1,,,,,,,,,,,,,,,
,"Kapuscinski, Jaroslaw; Sanchez, Javier",Jaroslaw,male,Canada,2009,2,Counterlines: Studies in Interfacing Graphic and Melodic Lines,ICMC,Javier,male,,,,,,,,,,,,,,,,,,,,,,,,,,,,,,,1,1,,,,,,,,,,,,,,,
,"Lossius, Trond; Baltazar, Pascal; de la Hogue, ThМ©o",Trond,male,Canada,2009,3,DBAP ‰ЫТ Distance-Based Amplitude Panning,ICMC,Pascal,male,ThМ©o,male,,,,,,,,,,,,,,,,,,,,,,,,,,,,,1,0.99,0.97,,,,,,,,,,,,,,
,"Pras, Amandine; FМ©ron, FranМ¤ois-Xavier; Demers, KaМшs",Amandine,female,Canada,2009,3,The Pre-Production Process of New York Counterpoint for Clarinet and Tape Written by Steve Reich,ICMC,FranМ¤ois-Xavier,male,KaМшs,None,,,,,,,,,,,,,,,,,,,,,,,,,,,,,1,1,None,,,,,,,,,,,,,,
,"Raphael, Christopher; Gu, Yupeng",Christopher,male,Canada,2009,2,Orchestral Accompaniment for a Reproducing Piano,ICMC,Yupeng,None,,,,,,,,,,,,,,,,,,,,,,,,,,,,,,,1,None,,,,,,,,,,,,,,,
,"Wang, Ge; Bryan, Nicholas; Oh, Jieun; Hamilton, Robert",Ge,male,Canada,2009,4,Stanford Laptop Orchestra (SLOrk),ICMC,Nicholas,male,Jieun,female,Robert,male,,,,,,,,,,,,,,,,,,,,,,,,,,,0.61,1,1,1,,,,,,,,,,,,,
,"CМБceres, Juan-Pablo; Chafe, Chris",Juan-Pablo,male,Canada,2009,2,JackTrip: Under the Hood of an Engine for Network Audio,ICMC,Chris,male,,,,,,,,,,,,,,,,,,,,,,,,,,,,,,,None,0.93,,,,,,,,,,,,,,,
,"Settel, Zack; Wozniewski, Mike; Bouillot, Nicolas; Cooperstock, Jeremy R.",Zack,male,Canada,2009,4,Audio Graffiti: A Location Based Audio-Tagging and Remixing Environment,ICMC,Mike,male,Nicolas,male,Jeremy,male,,,,,,,,,,,,,,,,,,,,,,,,,,,0.98,1,1,0.99,,,,,,,,,,,,,
,"Wetzel, David Brooke",David,male,Canada,2009,1,The Interactive Event Manager (IEM): A Performer‰ЫЄs Approach to Interactive System Design,ICMC,,,,,,,,,,,,,,,,,,,,,,,,,,,,,,,,,1,,,,,,,,,,,,,,,,
,"Bakht, Salman; Barlow, Clarence",Salman,male,Canada,2009,2,PAPAGEI: An Extensible Automatic Accompaniment System for Live Instrumental Improvisation,ICMC,Clarence,male,,,,,,,,,,,,,,,,,,,,,,,,,,,,,,,1,0.95,,,,,,,,,,,,,,,
,"Le Groux, Sylvain; Verschure, Paul F. M. J.",Sylvain,male,Canada,2009,2,Situated Interactive Music System: Connecting Mind and Body Through Musical Interaction,ICMC,Paul,male,,,,,,,,,,,,,,,,,,,,,,,,,,,,,,,1,1,,,,,,,,,,,,,,,
,"Pras, Amandine; Guastavino, Catherine",Amandine,female,Canada,2009,2,Improving the Sound Quality of Recordings Through Communication between Musicians and Sound Engineers,ICMC,Catherine,female,,,,,,,,,,,,,,,,,,,,,,,,,,,,,,,1,1,,,,,,,,,,,,,,,
,"Koyama, Shoichi; Suzuki, Risa",Shoichi,male,Canada,2009,2,Scape Synthesis: Generation of a Novel Acoustical Space Based on Auditory Perceptual Features,ICMC,Risa,female,,,,,,,,,,,,,,,,,,,,,,,,,,,,,,,1,1,,,,,,,,,,,,,,,
,"Bown, Oliver",Oliver,male,Canada,2009,1,Ecosystem Models for Real-Time Generative Music: A Methodology and Framework,ICMC,,,,,,,,,,,,,,,,,,,,,,,,,,,,,,,,,0.99,,,,,,,,,,,,,,,,
,"Eckel, Gerhard; PirrМ_, David",Gerhard,male,Canada,2009,2,On Artistic Research in the Context of the Project Embodied Generative Music,ICMC,David,male,,,,,,,,,,,,,,,,,,,,,,,,,,,,,,,1,1,,,,,,,,,,,,,,,
,"Mann, Steve; Janzen, Ryan",Steve,male,Canada,2009,2,Polyphonic Embouchure on an Intricately Expressive Musical Keyboard Formed by an Array of Water Jets,ICMC,Ryan,male,,,,,,,,,,,,,,,,,,,,,,,,,,,,,,,1,0.99,,,,,,,,,,,,,,,
,"Burns, Christopher",Christopher,male,Canada,2009,1,Sawtooth: Interface as Visualization,ICMC,,,,,,,,,,,,,,,,,,,,,,,,,,,,,,,,,1,,,,,,,,,,,,,,,,
,"Nanou, Chryssie; Hamilton, Robert",Chryssie,female,Canada,2009,2,For Jean-Claude: [re]Presenting Duet for One Pianist,ICMC,Robert,male,,,,,,,,,,,,,,,,,,,,,,,,,,,,,,,None,1,,,,,,,,,,,,,,,
,"Ding, Shiau-uen",Shiau-uen,female,Canada,2009,1,Rhythmic Practice in Music for Small Ensemble and Tape,ICMC,,,,,,,,,,,,,,,,,,,,,,,,,,,,,,,,,None,,,,,,,,,,,,,,,,
,"Lansky, Paul",Paul,male,Canada,2009,1,Reflections on Spent Time,ICMC,,,,,,,,,,,,,,,,,,,,,,,,,,,,,,,,,1,,,,,,,,,,,,,,,,
,"Matheussen, Kjetil",Kjetil,male,Canada,2009,1,Conservative Garbage Collectors for Realtime Audio Processing,ICMC,,,,,,,,,,,,,,,,,,,,,,,,,,,,,,,,,1,,,,,,,,,,,,,,,,
,"Miranda, Eduardo R",Eduardo,male,Ireland,2008,1,AUTONOMOUS DEVELOPMENT OF SINGING-LIKE INTONATIONS BY INTERACTING BABBLING ROBOTS,ICMC,,,,,,,,,,,,,,,,,,,,,,,,,,,,,,,,,1,,,,,,,,,,,,,,,,
,"Lazzarini, Victor; Timoney, Joseph; Lysaght, Thomas",Victor,male,Ireland,2008,3,SPLIT-SIDEBAND SYNTHESIS,ICMC,Joseph,male,Thomas,male,,,,,,,,,,,,,,,,,,,,,,,,,,,,,1,0.99,1,,,,,,,,,,,,,,
,"Berezan, David",David,male,Ireland,2008,1,IN FLUX ‰ЫТ A NEW APPROACH TO SOUND DIFFUSION PERFORMANCE PRACTICE FOR FIXED MEDIA MUSIC,ICMC,,,,,,,,,,,,,,,,,,,,,,,,,,,,,,,,,1,,,,,,,,,,,,,,,,
,"Collins, Nick",Nick,male,Ireland,2008,1,ERRANT SOUND SYNTHESIS,ICMC,,,,,,,,,,,,,,,,,,,,,,,,,,,,,,,,,0.99,,,,,,,,,,,,,,,,
,"Collins, Nick",Nick,male,Ireland,2008,1,REINFORCEMENT LEARNING FOR LIVE MUSICAL AGENTS,ICMC,,,,,,,,,,,,,,,,,,,,,,,,,,,,,,,,,0.99,,,,,,,,,,,,,,,,
,"Sigal, Rodrigo",Rodrigo,male,Ireland,2008,1,THE MEXICAN CENTRE FOR MUSIC AND SONIC ARTS STUDIO REPORT,ICMC,,,,,,,,,,,,,,,,,,,,,,,,,,,,,,,,,1,,,,,,,,,,,,,,,,
,"Lazzarini, Victor",Victor,male,Ireland,2008,1,A TOOLKIT FOR MUSIC AND AUDIO ACTIVITIES ON THE XO COMPUTER,ICMC,,,,,,,,,,,,,,,,,,,,,,,,,,,,,,,,,1,,,,,,,,,,,,,,,,
,"Lazzarini, Victor",Victor,male,Ireland,2008,1,INTERACTIVE AUDIO SIGNAL SCRIPTING,ICMC,,,,,,,,,,,,,,,,,,,,,,,,,,,,,,,,,1,,,,,,,,,,,,,,,,
,"Kirke, Alexis; Miranda, Eduardo R.",Alexis,male,Ireland,2008,2,AN INSTANCE BASED MODEL FOR GENERATING EXPRESSIVE PERFORMANCE DURING COMPOSITION,ICMC,Eduardo,male,,,,,,,,,,,,,,,,,,,,,,,,,,,,,,,0.52,1,,,,,,,,,,,,,,,
,"Freeman, Jason; Godfrey, Mark",Jason,male,Ireland,2008,2,"TECHNOLOGY, REAL-TIME NOTATION, AND AUDIENCE PARTICIPATION IN FLOCK",ICMC,Mark,male,,,,,,,,,,,,,,,,,,,,,,,,,,,,,,,1,1,,,,,,,,,,,,,,,
,"Solomon, Mike",Mike,male,Ireland,2008,1,STABILITY SPACE AND THE BELOW-N THRESHOLD: A COMPUTATIONAL APPROACH TO MUSIC ANALYSIS,ICMC,,,,,,,,,,,,,,,,,,,,,,,,,,,,,,,,,1,,,,,,,,,,,,,,,,
,"Collins, Nick",Nick,male,Ireland,2008,1,INFNO: GENERATING SYNTH POP AND ELECTRONIC DANCE MUSIC ON DEMAND,ICMC,,,,,,,,,,,,,,,,,,,,,,,,,,,,,,,,,0.99,,,,,,,,,,,,,,,,
,"Lazzarini, Victor; Walsh, Rory; Brogan, Martin",Victor,male,Ireland,2008,3,TWO CROSS-PLATFORM CSOUND-BASED PLUGIN GENERATORS,ICMC,Rory,male,Martin,male,,,,,,,,,,,,,,,,,,,,,,,,,,,,,1,0.94,1,,,,,,,,,,,,,,
,"Adkins, Mathew",Mathew,male,Ireland,2008,1,TOWARDS 'A BEAUTIFUL LAND': THE INFLUENCE OF ROTHKO AND ABSTRACT EXPRESSIONISM IN COMPOSING FIVE PANELS (NO. 5),ICMC,,,,,,,,,,,,,,,,,,,,,,,,,,,,,,,,,0.99,,,,,,,,,,,,,,,,
,"Neukom, Martin; Schacher, Jan C.",Martin,male,Ireland,2008,2,AMBISONICS EQUIVALENT PANNING,ICMC,Jan,male,,,,,,,,,,,,,,,,,,,,,,,,,,,,,,,1,0.6,,,,,,,,,,,,,,,
,"Kuuskankare, Mika; Laurson, Mikael",Mika,male,Ireland,2008,2,SURVEY OF MUSIC ANALYSIS AND VISUALIZATION TOOLS IN PWGL,ICMC,Mikael,male,,,,,,,,,,,,,,,,,,,,,,,,,,,,,,,0.51,1,,,,,,,,,,,,,,,
,"Moore, Adrian",Adrian,male,Ireland,2008,1,FRACTURING THE ACOUSMATIC: MERGING IMPROVISATION WITH DISASSEMBLED ACOUSMATIC MUSIC.,ICMC,,,,,,,,,,,,,,,,,,,,,,,,,,,,,,,,,0.97,,,,,,,,,,,,,,,,
,"Ferreira-Lopes, Paulo; Jensen, Filipe",Paulo,male,Ireland,2008,2,DIGITAL MUSIC INSTRUMENTS AND SOUND EXPRESSION,ICMC,Filipe,male,,,,,,,,,,,,,,,,,,,,,,,,,,,,,,,1,1,,,,,,,,,,,,,,,
,"Bisig, Daniel; Neukom, Martin; Flury, John",Daniel,male,Ireland,2008,3,INTERACTIVE SWARM ORCHESTRA A GENERIC PROGRAMMING ENVIRONMENT FOR SWARM BASED COMPUTER MUSIC,ICMC,Martin,male,John,male,,,,,,,,,,,,,,,,,,,,,,,,,,,,,1,1,0.99,,,,,,,,,,,,,,
,"Oliveira, AntМ_nio Pedro; Cardoso, AmМ_lcar",AntМ_nio,None,Ireland,2008,2,TOWARDS BI-DIMENSIONAL CLASSIFICATION OF SYMBOLIC MUSIC BY AFFECTIVE CONTENT,ICMC,AmМ_lcar,None,,,,,,,,,,,,,,,,,,,,,,,,,,,,,,,None,None,,,,,,,,,,,,,,,
,"Peters, Nils; Matthews, Tristan; Braasch, Jonas; McAdams, Stephen",Nils,male,Ireland,2008,4,VIMIC - A NOVEL TOOLBOX FOR SPATIAL SOUND PROCESSING IN MAX/MSP,ICMC,Tristan,male,Jonas,male,Stephen,male,,,,,,,,,,,,,,,,,,,,,,,,,,,0.99,0.95,1,1,,,,,,,,,,,,,
,"Petersen, Klaus; Solis, Jorge; Takanishi, Atsuo",Klaus,male,Ireland,2008,3,DEVELOPMENT OF A REAL-TIME GESTURAL INTERFACE FOR HANDS-FREE MUSICAL PERFORMANCE CONTROL,ICMC,Jorge,male,Atsuo,male,,,,,,,,,,,,,,,,,,,,,,,,,,,,,0.98,1,1,,,,,,,,,,,,,,
,"Yoo, Min-Joon; Lee, In-Kwon",Min-Joon,male,Ireland,2008,2,PATTERN-SPECIFIC PIANO EXERCISE RETRIEVAL,ICMC,In-Kwon,male,,,,,,,,,,,,,,,,,,,,,,,,,,,,,,,None,None,,,,,,,,,,,,,,,
,"Bisig, Daniel; Neukom, Martin; Flury, John",Daniel,male,Ireland,2008,3,INTERACTIVE SWARM ORCHESTRA AN ARTIFICIAL LIFE APPROACH TO COMPUTER MUSIC,ICMC,Martin,male,John,male,,,,,,,,,,,,,,,,,,,,,,,,,,,,,1,1,0.99,,,,,,,,,,,,,,
,"Simoni, Mary; Younker, Betty Anne",Mary,female,Ireland,2008,2,PROJECT LOVELACE: TEENAGE GIRLS AND TECHNOLOGY-BASED COMPOSITION,ICMC,Betty,female,,,,,,,,,,,,,,,,,,,,,,,,,,,,,,,1,1,,,,,,,,,,,,,,,
,"Hulen, Peter Lucas",Peter,male,Ireland,2008,1,A LOW-COST SPHERICAL LOUDSPEAKER ARRAY FOR ELECTROACOUSTIC MUSIC,ICMC,,,,,,,,,,,,,,,,,,,,,,,,,,,,,,,,,1,,,,,,,,,,,,,,,,
,"Boehm, Carola",Carola,female,Ireland,2008,1,‰ЫПWEEDS IN THE CRACKS‰Ыќ: INTERDISCIPLINARITY AND MUSIC TECHNOLOGY IN HIGHER EDUCATION,ICMC,,,,,,,,,,,,,,,,,,,,,,,,,,,,,,,,,1,,,,,,,,,,,,,,,,
,"McMillen, Keith A.",Keith,male,Ireland,2008,1,COMPUTER INPUT DEVICE FOR POLYPHONIC STRINGED INSTRUMENTS,ICMC,,,,,,,,,,,,,,,,,,,,,,,,,,,,,,,,,0.99,,,,,,,,,,,,,,,,
,"Hamanaka, Masatoshi; Hirata, Keiji; Tojo, Satoshi",Masatoshi,male,Ireland,2008,3,MELODY MORPHING METHOD BASED ON GTTM,ICMC,Keiji,male,Satoshi,male,,,,,,,,,,,,,,,,,,,,,,,,,,,,,1,1,1,,,,,,,,,,,,,,
,"McMillen, Keith A.",Keith,male,Ireland,2008,1,SENSOR BOWS & APPLICATION FOR STRINGED INSTRUMENTS,ICMC,,,,,,,,,,,,,,,,,,,,,,,,,,,,,,,,,0.99,,,,,,,,,,,,,,,,
,"d‰ЫЄEscrivМБn, Julio; Truнцtzschler von Falkenstein, Jan",Julio,male,Ireland,2008,2,TEATRACKS: A DEMONSTRATION OF AN AUDITORY DISPLAY OF A MULTITRACK SOUND SEQUENCER,ICMC,Jan,male,,,,,,,,,,,,,,,,,,,,,,,,,,,,,,,1,0.6,,,,,,,,,,,,,,,
,"Kim-Boyle, David",David,male,Ireland,2008,1,"NETWORK MUSICS - PLAY, ENGAGEMENT AND THE DEMOCRATIZATION OF PERFORMANCE",ICMC,,,,,,,,,,,,,,,,,,,,,,,,,,,,,,,,,1,,,,,,,,,,,,,,,,
,"Rousseaux, Francis; Bonardi, Alain; Roadley, Benjamin",Francis,male,Ireland,2008,3,DIGITAL MUSIC COLLECTIONS: A PLACE OF KNOWLEDGE EMERGENCE?,ICMC,Alain,male,Benjamin,male,,,,,,,,,,,,,,,,,,,,,,,,,,,,,0.89,1,1,,,,,,,,,,,,,,
,"Didkovsky, Nick; Hajdu, Georg",Nick,male,Ireland,2008,2,MAXSCORE: MUSIC NOTATION IN MAX/MSP,ICMC,Georg,male,,,,,,,,,,,,,,,,,,,,,,,,,,,,,,,0.99,1,,,,,,,,,,,,,,,
,"Tomczak, Sebastian",Sebastian,male,Ireland,2008,1,AUTHENTICITY AND EMULATION: CHIPTUNE IN THE EARLY TWENTY-FIRST CENTURY,ICMC,,,,,,,,,,,,,,,,,,,,,,,,,,,,,,,,,1,,,,,,,,,,,,,,,,
,"Ong, Bee Suan; Streich, Sebastian",Bee,female,Ireland,2008,2,AN EFFICIENT OFF-LINE BEAT TRACKING METHOD FOR MUSIC WITH STEADY TEMPO,ICMC,Sebastian,male,,,,,,,,,,,,,,,,,,,,,,,,,,,,,,,0.75,1,,,,,,,,,,,,,,,
,"Streich, Sebastian; Ong, Bee Suan",Sebastian,male,Ireland,2008,2,A MUSIC LOOP EXPLORER SYSTEM,ICMC,Bee,female,,,,,,,,,,,,,,,,,,,,,,,,,,,,,,,1,0.75,,,,,,,,,,,,,,,
,"Thalmann, Florian; Mazzola, Guerino",Florian,male,Ireland,2008,2,THE BIGBANG RUBETTE: GESTURAL MUSIC COMPOSITION WITH RUBATO COMPOSER,ICMC,Guerino,male,,,,,,,,,,,,,,,,,,,,,,,,,,,,,,,1,1,,,,,,,,,,,,,,,
,"Wang, Ge; Essl, Georg; Penttinen, Henri",Ge,male,Ireland,2008,3,DO MOBILE PHONES DREAM OF ELECTRIC ORCHESTRAS?,ICMC,Georg,male,Henri,male,,,,,,,,,,,,,,,,,,,,,,,,,,,,,0.61,1,0.98,,,,,,,,,,,,,,
,"Ng, Kia; Mikroyannidis, Alexander; Ong, Bee; Bonardi, Alain; BarthМ©lemy, JМ©rМ«me; Ciavarella, Raffaele",Kia,female,Ireland,2008,6,ONTOLOGY MANAGEMENT FOR PRESERVATION OF INTERACTIVE MULTIMEDIA PERFORMANCES,ICMC,Alexander,male,Bee,female,Alain,male,JМ©rМ«me,male,Raffaele,male,,,,,,,,,,,,,,,,,,,,,,,0.95,1,0.75,1,1,1,,,,,,,,,,,
,"Ng, Kia; Weyde, Tillman; Nesi, Paolo",Kia,female,Ireland,2008,3,I-MAESTRO: TECHNOLOGY-ENHANCED LEARNING FOR MUSIC,ICMC,Tillman,male,Paolo,male,,,,,,,,,,,,,,,,,,,,,,,,,,,,,0.95,1,0.99,,,,,,,,,,,,,,
,"Adiloglu, Kamil; AnniМ©s, Robert; Obermayer, Klaus; Visell, Yon; Drioli, Carlo",Kamil,male,Ireland,2008,5,ADAPTIVE BOTTLE,ICMC,Robert,male,Klaus,male,Yon,male,Carlo,male,,,,,,,,,,,,,,,,,,,,,,,,,0.99,1,0.98,1,0.99,,,,,,,,,,,,
,"Tanzi, Dante",Dante,male,Ireland,2008,1,DIGITAL TIME: COMPLEXITY AND PERCEPTION,ICMC,,,,,,,,,,,,,,,,,,,,,,,,,,,,,,,,,0.98,,,,,,,,,,,,,,,,
,"Burns, Kristine H.",Kristine,female,Ireland,2008,1,HOW TO MAKE YOUR WIFE LISTEN: THE PORTRAYAL OF WOMEN IN MUSIC TECHNOLOGY PUBLICATIONS,ICMC,,,,,,,,,,,,,,,,,,,,,,,,,,,,,,,,,1,,,,,,,,,,,,,,,,
,"Harker, Alex; Atmadjaja, Angie; Bagust, Jethro; Field, Ambrose",Alex,male,Ireland,2008,4,"THE WORLDSCAPE LAPTOP ORCHESTRA: CREATING LIVE, INTERACTIVE DIGITAL MUSIC FOR AN ENSEMBLE OF FIFTY PERFORMERS",ICMC,Angie,female,Jethro,male,Ambrose,male,,,,,,,,,,,,,,,,,,,,,,,,,,,0.87,1,0.97,1,,,,,,,,,,,,,
,"Burns, Christopher; Surges, Greg",Christopher,male,Ireland,2008,2,NRCI: SOFTWARE TOOLS FOR LAPTOP ENSEMBLE,ICMC,Greg,male,,,,,,,,,,,,,,,,,,,,,,,,,,,,,,,1,1,,,,,,,,,,,,,,,
,"Costalonga, Leandro; Miranda, Eduardo R.",Leandro,male,Ireland,2008,2,EQUIPPING ARTIFICIAL GUITAR PLAYERS WITH BIOMECHANICAL CONSTRAINS: A CASE STUDY OF PRECISION AND SPEED,ICMC,Eduardo,male,,,,,,,,,,,,,,,,,,,,,,,,,,,,,,,1,1,,,,,,,,,,,,,,,
,"Ciglar, Miha",Miha,male,Ireland,2008,1,A Full-body Gesture Recognition System and its Integration in the Composition ‰ЫП3rd. Pole‰Ыќ,ICMC,,,,,,,,,,,,,,,,,,,,,,,,,,,,,,,,,0.88,,,,,,,,,,,,,,,,
,"Percival, Graham; Anders, Torsten",Graham,male,Ireland,2008,2,GENERATING TARGETED RHYTHMIC EXERCISES FOR MUSIC STUDENTS WITH CONSTRAINT SATISFACTION PROGRAMMING,ICMC,Torsten,male,,,,,,,,,,,,,,,,,,,,,,,,,,,,,,,1,1,,,,,,,,,,,,,,,
,"Matheussen, Kjetil",Kjetil,male,Ireland,2008,1,REALTIME MUSIC PROGRAMMING USING SND-RT,ICMC,,,,,,,,,,,,,,,,,,,,,,,,,,,,,,,,,1,,,,,,,,,,,,,,,,
,"Barrett, G. Douglas; Gagliardi, Francesco",Douglas,male,Ireland,2008,2,Performing the City: An Urban Performance Workshop,ICMC,Francesco,male,,,,,,,,,,,,,,,,,,,,,,,,,,,,,,,1,1,,,,,,,,,,,,,,,
,"Pan, Wei; Johnson, Micah K.; Polansky, Larry; Rockmore, Daniel; Repetto, Douglas",Wei,None,Ireland,2008,5,OWT: A REAL-TIME OPTIMAL TUNING APPLICATION,ICMC,Micah,male,Larry,male,Daniel,male,Douglas,male,,,,,,,,,,,,,,,,,,,,,,,,,0.54,0.81,1,1,1,,,,,,,,,,,,
,"Norilo, Vesa; Laurson, Mikael",Vesa,male,Ireland,2008,2,A UNIFIED MODEL FOR AUDIOAND CONTROL SIGNALS IN PWGLSYNTH,ICMC,Mikael,male,,,,,,,,,,,,,,,,,,,,,,,,,,,,,,,0.93,1,,,,,,,,,,,,,,,
,"Sturm, Bob L.; Roads, Curtis; McLeran, Aaron; Shynk, John J.",Bob,male,Ireland,2008,4,"ANALYSIS, VISUALIZATION, AND TRANSFORMATION OF AUDIO SIGNALS USING DICTIONARY-BASED METHODS",ICMC,Curtis,male,Aaron,male,John,male,,,,,,,,,,,,,,,,,,,,,,,,,,,0.98,1,1,0.99,,,,,,,,,,,,,
,"Whalley, Ian",Ian,male,Ireland,2008,1,"TECHNOLOGY, CULTURE AND LOCATION IN A RECENT NEW ZEALAND SONIC ART PROJECT",ICMC,,,,,,,,,,,,,,,,,,,,,,,,,,,,,,,,,0.99,,,,,,,,,,,,,,,,
,"Hoffman, Matthew D.; Cook, Perry R.; Blei, David",Matthew,male,Ireland,2008,3,DATA-DRIVEN RECOMPOSITION USING THE HIERARCHICAL DIRICHLET PROCESS HIDDEN MARKOV MODEL,ICMC,Perry,male,David,male,,,,,,,,,,,,,,,,,,,,,,,,,,,,,1,0.94,1,,,,,,,,,,,,,,
,"Pestova, Xenia; Marshall, Mark T.; Sudol, Jacob",Xenia,female,Ireland,2008,3,ANALOGUE TO DIGITAL: AUTHENTICIY VS. SUSTAINABILITY IN STOCKHAUSEN‰ЫЄS MANTRA (1970),ICMC,Mark,male,Jacob,male,,,,,,,,,,,,,,,,,,,,,,,,,,,,,1,1,1,,,,,,,,,,,,,,
,"Schedel, Margaret; Rootberg, Alison",Margaret,female,Ireland,2008,2,SCORING THE COLOR OF WAITING,ICMC,Alison,female,,,,,,,,,,,,,,,,,,,,,,,,,,,,,,,0.98,0.99,,,,,,,,,,,,,,,
,"CМБceres, Juan-Pablo; Renaud, Alain B.",Juan-Pablo,male,Ireland,2008,2,PLAYING THE NETWORK: THE USE OF TIME DELAYS AS MUSICAL DEVICES,ICMC,Alain,male,,,,,,,,,,,,,,,,,,,,,,,,,,,,,,,None,1,,,,,,,,,,,,,,,
,"Ouzounian, Gascia",Gascia,female,Ireland,2008,1,THE SPATIAL POLITICS OF RADIO: ANNA FRIZ‰ЫЄS CRITICAL UTOPIAS,ICMC,,,,,,,,,,,,,,,,,,,,,,,,,,,,,,,,,None,,,,,,,,,,,,,,,,
,"Kobayashi, Yohei; Osaka, Naotoshi",Yohei,male,Ireland,2008,2,CONSTRUCTION OF AN ELECTRONIC TIMBRE DICTIONARY FOR ENVIRONMENTAL SOUNDS BY TIMBRE SYMBOL,ICMC,Naotoshi,male,,,,,,,,,,,,,,,,,,,,,,,,,,,,,,,1,None,,,,,,,,,,,,,,,
,"Hsu, William",William,male,Ireland,2008,1,TWO APPROACHES FOR INTERACTION MANAGEMENT IN TIMBRE-AWARE IMPROVISATION SYSTEMS,ICMC,,,,,,,,,,,,,,,,,,,,,,,,,,,,,,,,,1,,,,,,,,,,,,,,,,
,"Grierson, Mick",Mick,male,Ireland,2008,1,COMPOSING WITH BRAINWAVES: MINIMAL TRIAL P300 RECOGNITION AS AN INDICATION OF SUBJECTIVE PREFERENCE FOR THE CONTROL OF A MUSICAL INSTRUMENT,ICMC,,,,,,,,,,,,,,,,,,,,,,,,,,,,,,,,,0.99,,,,,,,,,,,,,,,,
,"Maxwell, James B.; Eigenfeldt, Arne",James,male,Ireland,2008,2,The MusicDB: A Music Database Query System for Recombinance-based Composition in Max/MSP,ICMC,Arne,male,,,,,,,,,,,,,,,,,,,,,,,,,,,,,,,0.99,1,,,,,,,,,,,,,,,
,"Goodman, Rob",Rob,male,Ireland,2008,1,THE ENIGMA OF VITRUVIAN RESONATING VASES AND THE RELEVANCE OF THE CONCEPT FOR TODAY,ICMC,,,,,,,,,,,,,,,,,,,,,,,,,,,,,,,,,0.99,,,,,,,,,,,,,,,,
,"BМ_ckman, Kjell",Kjell,male,Ireland,2008,1,AUTOMATIC FITNESS IN GENERATIVE JAZZ IMPROVISATION,ICMC,,,,,,,,,,,,,,,,,,,,,,,,,,,,,,,,,1,,,,,,,,,,,,,,,,
,"Hagan, Kerry L.",Kerry,female,Ireland,2008,1,TEXTURAL COMPOSITION: IMPLEMENTATION OF AN INTERMEDIARY AESTHETIC,ICMC,,,,,,,,,,,,,,,,,,,,,,,,,,,,,,,,,0.88,,,,,,,,,,,,,,,,
,"Cupellini, Enrico; Rizzuti, Constantino; Bilotta, Eleonora; Pantano, Pietro; Wozniewski, Michael; Cooperstock, Jeremy R.",Enrico,male,Ireland,2008,6,EXPLORING MUSICAL MAPPINGS AND GENERATING ACCOMPANIMENT WITH CHAOTIC SYSTEMS,ICMC,Constantino,male,Eleonora,female,Pietro,male,Michael,male,Jeremy,male,,,,,,,,,,,,,,,,,,,,,,,0.97,1,1,1,1,0.99,,,,,,,,,,,
,"BarthМ©lemy, JМ©rМ«me; Bonardi, Alain; Boutard, Guillaume; Ciavarella, Raffaele",JМ©rМ«me,male,Ireland,2008,4,OUR RESEARCH FOR LOST ROUTE TO ROOT,ICMC,Alain,male,Guillaume,male,Raffaele,male,,,,,,,,,,,,,,,,,,,,,,,,,,,1,1,1,1,,,,,,,,,,,,,
,"Brough, Samantha",Samantha,female,Ireland,2008,1,APPLICATIONS OF GEOSCIENTIFIC SONIFICATION: PRELIMINARY RESULTS ‰ЫТ WHERE IS MY RESERVOIR?,ICMC,,,,,,,,,,,,,,,,,,,,,,,,,,,,,,,,,1,,,,,,,,,,,,,,,,
,"Bates, Enda; Furlong, Dermot; Dennehy, Donnacha",Enda,male,Ireland,2008,3,ADAPTING POLYPHONIC PICKUP TECHNOLOGY FOR SPATIAL MUSIC PERFORMANCE,ICMC,Dermot,male,Donnacha,male,,,,,,,,,,,,,,,,,,,,,,,,,,,,,0.96,1,1,,,,,,,,,,,,,,
,"ffitch, John; Padget, Julian",John,male,Ireland,2008,2,MAINTAINING AND USING PROVENANCE DATA IN COMPUTER MUSIC,ICMC,Julian,male,,,,,,,,,,,,,,,,,,,,,,,,,,,,,,,0.99,1,,,,,,,,,,,,,,,
,"Beck, Stephen David",Stephen,male,Ireland,2008,1,THE LAB FOR CREATIVE ARTS & TECHNOLOGIES 2008 STUDIO REPORT,ICMC,,,,,,,,,,,,,,,,,,,,,,,,,,,,,,,,,1,,,,,,,,,,,,,,,,
,"Quested, Garry; Boyle, Roger; Ng, Kia",Garry,male,Ireland,2008,3,POLYPHONIC NOTE TRACKING USING MULTIMODAL RETRIEVAL OF MUSICAL EVENTS,ICMC,Roger,male,Kia,female,,,,,,,,,,,,,,,,,,,,,,,,,,,,,1,1,0.95,,,,,,,,,,,,,,
,"Anders, Torsten; Miranda, Eduardo R.",Torsten,male,Ireland,2008,2,CONSTRAINT-BASED COMPOSITION IN REALTIME,ICMC,Eduardo,male,,,,,,,,,,,,,,,,,,,,,,,,,,,,,,,1,1,,,,,,,,,,,,,,,
,"Anders, Torsten; Miranda, Eduardo R.",Torsten,male,Ireland,2008,2,HIGHER-ORDER CONSTRAINT APPLICATORS FOR MUSIC CONSTRAINT PROGRAMMING,ICMC,Eduardo,male,,,,,,,,,,,,,,,,,,,,,,,,,,,,,,,1,1,,,,,,,,,,,,,,,
,"KrМ¦ger, Pedro; Passos, Alexandre; Sampaio, Marcos",Pedro,male,Ireland,2008,3,RAMEAU: A SYSTEM FOR AUTOMATIC HARMONIC ANALYSIS,ICMC,Alexandre,male,Marcos,male,,,,,,,,,,,,,,,,,,,,,,,,,,,,,0.99,1,1,,,,,,,,,,,,,,
,"Bukvic, Ivica Ico; Gracanin, Denis; Quek,Francis",Ivica,male,Ireland,2008,3,INVESTIGATING ARTISTIC POTENTIAL OF THE DREAM INTERFACE: THE AURAL PAINTING,ICMC,Denis,male,Francis,male,,,,,,,,,,,,,,,,,,,,,,,,,,,,,0.98,0.93,0.89,,,,,,,,,,,,,,
,"Young, Michael; Drever, John; Grierson, Mick; Stonehouse, Ian",Michael,male,Ireland,2008,4,GOLDSMITHS ELECTRONIC MUSIC STUDIOS: 40 YEARS,ICMC,John,male,Mick,male,Ian,male,,,,,,,,,,,,,,,,,,,,,,,,,,,1,0.99,0.99,0.99,,,,,,,,,,,,,
,"Nilsson, Per Anders",Per,male,Ireland,2008,1,THE WALKING MACHINE,ICMC,,,,,,,,,,,,,,,,,,,,,,,,,,,,,,,,,0.98,,,,,,,,,,,,,,,,
,"Mooney, James; Moore, David",James,male,Ireland,2008,2,RESOUND: OPEN-SOURCE LIVE SOUND SPATIALISATION,ICMC,David,male,,,,,,,,,,,,,,,,,,,,,,,,,,,,,,,0.99,1,,,,,,,,,,,,,,,
,"Holm, Jukka",Jukka,male,Ireland,2008,1,POPULARITY OF MUSIC PLAYER PARAMETERS AND FEATURES,ICMC,,,,,,,,,,,,,,,,,,,,,,,,,,,,,,,,,1,,,,,,,,,,,,,,,,
,"Loughran, RМ_isМ_n; Walker, Jacqueline; O‰ЫЄNeill, Michael; O‰ЫЄFarrell, Marion",RМ_isМ_n,female,Ireland,2008,4,The Use of Mel-frequency Cepstral Coefficients in Musical Instrument Identification,ICMC,Jacqueline,female,Michael,male,Marion,female,,,,,,,,,,,,,,,,,,,,,,,,,,,1,1,1,0.97,,,,,,,,,,,,,
,"McLean, Alex; Wiggins, Geraint",Alex,male,Ireland,2008,2,VOCABLE SYNTHESIS,ICMC,Geraint,male,,,,,,,,,,,,,,,,,,,,,,,,,,,,,,,0.87,1,,,,,,,,,,,,,,,
,"CМБdiz, Rodrigo F.; de la Cuadra, Patricio",Rodrigo,male,Ireland,2008,2,STOCHASTIC RESONANCE SOUND SYNTHESIS,ICMC,Patricio,male,,,,,,,,,,,,,,,,,,,,,,,,,,,,,,,1,0.99,,,,,,,,,,,,,,,
,"Kim-Boyle, David",David,male,Ireland,2008,1,SPECTRAL SPATIALIZATION - AN OVERVIEW,ICMC,,,,,,,,,,,,,,,,,,,,,,,,,,,,,,,,,1,,,,,,,,,,,,,,,,
,"Filatriau, Jean-Julien; Kessous, Loic",Jean-Julien,male,Ireland,2008,2,"VISUAL AND SOUND GENERATION DRIVEN BY BRAIN, HEART AND RESPIRATION SIGNALS",ICMC,Loic,male,,,,,,,,,,,,,,,,,,,,,,,,,,,,,,,None,0.99,,,,,,,,,,,,,,,
,"Palacio-Quintin, ClМ©o; Zadel, Mark",ClМ©o,None,Ireland,2008,2,INTERACTIVE COMPOSITION AND IMPROVISATION ON THE HYPER-FLUTE,ICMC,Mark,male,,,,,,,,,,,,,,,,,,,,,,,,,,,,,,,None,1,,,,,,,,,,,,,,,
,"Bailey, Nicholas; McGilvray, Douglas; Hair, Graham; Pearson, Ingrid; Morrison, Amanda; Parncutt, Richard",Nicholas,male,Ireland,2008,6,THE ROSEGARDEN CODICIL: REHEARSING MUSIC IN NINETEEN-TONE EQUAL TEMPERAMENT,ICMC,Douglas,male,Graham,male,Ingrid,female,Amanda,female,Richard,male,,,,,,,,,,,,,,,,,,,,,,,1,1,1,1,1,1,,,,,,,,,,,
,"Bloch, Georges; Dubnov, Shlomo",Georges,male,Ireland,2008,2,INTRODUCING VIDEO FEATURES AND SPECTRAL DESCRIPTORS IN THE OMAX IMPROVISATION SYSTEM,ICMC,Shlomo,male,,,,,,,,,,,,,,,,,,,,,,,,,,,,,,,0.99,1,,,,,,,,,,,,,,,
,"TahiroЂЩlu, Koray; Drayson, Hannah; Erkut, Cumhur",Koray,male,Ireland,2008,3,AN INTERACTIVE BIO-MUSIC IMPROVISATION SYSTEM,ICMC,Hannah,female,Cumhur,male,,,,,,,,,,,,,,,,,,,,,,,,,,,,,1,1,1,,,,,,,,,,,,,,
,"Kiefer, Chris; Collins, Nick; Fitzpatrick, Geraldine",Chris,male,Ireland,2008,3,EVALUATING THE WIIMOTE AS A MUSICAL CONTROLLER,ICMC,Nick,male,Geraldine,female,,,,,,,,,,,,,,,,,,,,,,,,,,,,,0.93,0.99,1,,,,,,,,,,,,,,
,"Dobson, Richard; ffitch, John; Bradford, Russell",Richard,male,Ireland,2008,3,HIGH-PERFORMANCE AUDIO COMPUTING ‰ЫУA POSITION PAPER,ICMC,John,male,Russell,male,,,,,,,,,,,,,,,,,,,,,,,,,,,,,1,0.99,1,,,,,,,,,,,,,,
,"Gallot, Fabien; Lagadec, Owen; Desainte- Catherine, Myriam; Marchand, Sylvain",Fabien,male,Ireland,2008,4,IKLAX : A NEW MUSICAL AUDIO FORMAT FOR INTERACTIVE MUSIC,ICMC,Owen,male,Myriam,female,Sylvain,male,,,,,,,,,,,,,,,,,,,,,,,,,,,1,0.99,1,1,,,,,,,,,,,,,
,"Leslie, Grace; Hassanpour, Navid",Grace,female,Ireland,2008,2,A GAME THEORETICAL MODEL FOR MUSICAL INTERACTION,ICMC,Navid,male,,,,,,,,,,,,,,,,,,,,,,,,,,,,,,,0.99,1,,,,,,,,,,,,,,,
,"Hanna, Pierre; Robine, Matthias; Ferraro, Pascal",Pierre,male,Ireland,2008,3,VISUALISATION OF MUSICAL STRUCTURE BY APPLYING IMPROVED EDITING ALGORITHMS,ICMC,Matthias,male,Pascal,male,,,,,,,,,,,,,,,,,,,,,,,,,,,,,0.99,1,0.99,,,,,,,,,,,,,,
,"Jordanous, Anna",Anna,female,Ireland,2008,1,VOICE SEPARATION IN POLYPHONIC MUSIC: A DATA-DRIVEN APPROACH,ICMC,,,,,,,,,,,,,,,,,,,,,,,,,,,,,,,,,1,,,,,,,,,,,,,,,,
,"Jensenius, Alexander Refsum; Nymoen, Kristian; GodМьy, Rolf Inge",Alexander,male,Ireland,2008,3,A MULTILAYERED GDIF-BASED SETUP FOR STUDYING COARTICULATION IN THE MOVEMENTS OF MUSICIANS,ICMC,Kristian,male,Rolf,male,,,,,,,,,,,,,,,,,,,,,,,,,,,,,1,0.94,1,,,,,,,,,,,,,,
,"Sang, To Yip; Wong, Kam",To,None,Ireland,2008,2,MULTI-USER HAND GESTURE BASED MUSICAL ELEMENT MAPPING WITH TRADITIONAL MUSICAL ELEMENTS,ICMC,Kam,male,,,,,,,,,,,,,,,,,,,,,,,,,,,,,,,0.71,0.61,,,,,,,,,,,,,,,
,"Kirke, Alexis; Miranda, Eduardo R.",Alexis,male,Ireland,2008,2,COMPER: TOWARDS A MODEL FOR GENERATING COMPOSITIONS FROM EXPRESSIVE MUSIC PERFORMANCES,ICMC,Eduardo,male,,,,,,,,,,,,,,,,,,,,,,,,,,,,,,,0.52,1,,,,,,,,,,,,,,,
